{
  "schema_version": "1.0.0",
  "advice_enquiry_id": "8c513f43-fb17-4081-9165-4cb603f25f9a",
  "tenant_id": "tenant_demo",
  "correlation_id": "cor_advice_email_vulnerability_support_001",
  "channel": "email",
  "adapter_id": "email-channel",
  "message_id": "<advice-enquiry-vulnerability-support-001@example.test>",
  "received_at": "2026-05-01T10:30:00Z",
  "source_payload_ref": "source_payload_advice_email_vulnerability_support_001",
  "mailbox_ref": "mailbox_ifa_intake",
  "sender_contact_ref": "contact_advice_sender_002",
  "prospective_retail_client_ref": "prospective_client_demo_ifa_003",
  "subject_summary": "Vulnerability support handoff fixture",
  "advice_need_summary": "Bounded summary of an advice enquiry with support categories requiring Consumer Duty handoff before any suitability report path.",
  "advice_need_categories": [
    "pension_consolidation",
    "retirement_planning"
  ],
  "declared_objective_categories": [
    "retirement_planning",
    "portfolio_simplification"
  ],
  "product_context_categories": [
    "pension",
    "isa"
  ],
  "support_need_categories": [
    "communication_adjustment",
    "third_party_authority",
    "health_marker"
  ],
  "attachments_summary": [
    {
      "attachment_ref": "attachment_support_need_evidence_001",
      "document_category": "support_need_evidence",
      "content_type": "application/pdf",
      "size_bytes": 41230,
      "sha256": "sha256:3333333333333333333333333333333333333333333333333333333333333333"
    }
  ]
}
